"Consistency of original with replications, $P_{\mbox{orig}}$",,This metric is defined as the $p$-value for a null-hypothesis that the effect size of the original study and the effect size pf the replication study (or effect sizes of several replication studies) follow the same distribution.,"(1) account for all relevant sources of statistical uncertainty in many-to-one replication designs, including heterogeneity (2) allow for the assessment of many-to-one replication designs","""To what extent are the replication effect sizes consistent with the effect size of an original study?""",Yes,Consistency; Replication,Different data - same analysis; Different data - different analysis,,One original study and several replication studies,To quantify (continuous) ,"Quantification of consistency of the original study with the replication studies, while accounting for heterogeneity across the population effects",A formula,Quantitative and objective,Ready-to-use open-source tool: R packages Replicate and MetaUtility,Results - numbers and tables,(1) Replications are supposed to yield unbiased estimates (2) Assumes that the population effects are normally distributed (3) replications measure potentially heterogeneous effects,,\cite{mathur_new_2019},"\cite{mathur_challenges_2019, mathur_new_2020}","\cite{boyce_eleven_2023, ebersole_many_2020}"
"Proportion of population effects agreeing in direction with the original, $\hat{P}_{>0}$",,"This metric assesses the strength of evidence of the replication effect sizes going in the same direction as the original effect size, by estimating the proportion of population effects agreeing in direction with the original effect estimate. It can be generalized by ensuring that they do not only agree in direction but are also stronger than a chosen threshold.","(1) account for all relevant sources of statistical uncertainty in many-to-one replication designs, including heterogeneity (2) allow for the assessment of many-to-one replication designs","""To what extent do the replication effect sizes agree with the sign found in the original study?""",Yes,Consistency; Replication,Different data - same analysis; Different data - different analysis,,One original study and several replication studies,To quantify (continuous) ,Quantifies the strenght of evidence,A formula,Quantitative and objective,Ready-to-use open-source tool: R packages Replicate and MetaUtility,Results - numbers and tables,(1) Replications are supposed to yield unbiased estimates,,\cite{mathur_new_2019},"\cite{mathur_challenges_2019, mathur_new_2020}",\cite{ebersole_many_2020}
RepliCATS,,"The process elicits expert predictions about the reproducibility of research. It is based on a modified Delphi technique and includes four steps represented in the acronym IDEA: ‘Investigate’, ‘Discuss’, ‘Estimate’ and ‘Aggregate’. Each individual is provided a scientific claim and the original research paper to read, and provide an estimate of whether or not the claim will replicate (Investigate). They then see the group’s judgments and reasoning, and can interrogate these (Discuss). Following this, each individual provides a second private assessment (Estimate). A mathematical aggregation of the individual estimates is taken as the final assessment (Aggregate).",,"""How reliable do experts believe the claims from an original finding are?""",Yes,Reliability; Replication; Replicability; Generalisability,Different data - same analysis,,One original study,To quantify (continuous); To predict,Predicts the reproducibility/reliability of a claim,A study; A survey or questionnaire,"Quantitative, qualitative and subjective","Clear implementation, but hard to implement","Qualitative data, surveys or questionnaires",(1) based on human-elicitations (2) the IDEA groups are deliberately constructed to be diverse,"(1) Validated for psychology papers only (2) recruitment burden (3) elicitation burden: both the quantity and quality of information provided by experts are thought to decline the longer the elicitation process takes, similar to participant fatigue in surveys and experiments",\cite{fraser_predicting_2023},,\cite{alipourfard_systematizing_2024}
RepeAT - Repeatability Assessment Tool,,"The tool was developed using a multi-phase method to determine components needed for reproducing biomedical data: a literature review generated a framework which was tested and refined. The RepeAT framework now contains 119 unique variables that were grouped into five categories which address different components for reproducible research: research design and aim, database and data collection methods, data mining and data cleaning, data analysis, data sharing and documentation.",,"""Does the presented research align with community standards of reproducible biomedical research, using electronic health records?""",Yes,Reproducibility,Same data - same analysis; Different data - same analysis,,One original study,To quantify (continuous),Quantifies the alignement of the research with community standards,A framework; A study; A survey or questionnaire,Quantitative; Subjective,Unclear implementation,"Results - numbers and tables; Qualitative data, surveys or questionnaires",,(1) This tool has been developed for research using electronic health records,\cite{mcintosh_repeat_2017},,
P interval,,"The p interval, or prediction interval for p, is an interval with a specified chance (usually 80\%) of including the $p$-value given by a replication.",(1) can act as a remedy against the replication fallacy: the false belief that 1-p is the probability a result will replicate or that a repetition of the experiment will give a statistically significant,"""Given the results of an original study, what is the range of $p$-values a replication (following the same design) would lie in with 80\% probability?""",Yes,Replication,Different data - same analysis,,One original study,To predict,To predict the $p$-value of a future replication study,A formula,Quantitative and objective,Clear implementation,Results - numbers and tables,(1) different assumptions give slightly different versions of the p interval,(1) heavily depends on assumptions,\cite{cumming_replication_2008},,
RipetaScore,,"The ripetaScore combines three aspects of trust for a total of 30 points: 1. using the “Trust in Research” criteria it is determined whether a paper is a research paper. Only then will the paper continue to be scored. 2. The paper is then evaluated for the presence of reproducibility quality indicators and it can receive up to 20 points. Another 10 points come from the trust in professionalism quality indicators. For the trust in reproducibility criteria, papers are primarily evaluated with regards to their data/code sharing practices, reporting of methods, and citing software. These criteria are all assessed via natural language processing.",(1) very scalable,"""Given certain trust in research, reproducibility and professionalism quality indicators, how high does a paper score?""",Yes,Reproducibility; Replicability,Same data - same analysis; Different data - same analysis,,One original study,To quantify (continuous),On a 30 point scale,An algorithm,"Quantitative, qualitative and subjective",Ready-to-use closed tool; Hard to implement: based on a service from a company - Ripeta which was purchased by DigitalScience in 2023,Text,(1) Ripeta comes with a cost,(1) Like any NLP model it is limited by the training data,\cite{sumner_ripetascore_2022},,
Bland-Altman Plot,Agreement measures,"When two measures are compared (for example replications and their original studies), the mean difference between the measures and standard deviations of the difference are used to define the limits of agreement. Then the average effect (average of replication and original effect) is plotted against the difference in effect size. The two measures can be used interchangeably if most of the points lie inside the limits of agreement. Other related agreement parameters can be used as well.",,"""Do the effects estimated in several original-replication study pairs agree with each other?"" - ""How good is the agreement between repeated measures/studies?""",No,Agreement; Repeatability,Same data - same analysis; Same data - different analysis; Different data - same analysis; Different data - different analysis,,Several pairs of original and replication studies,To quantify (continuous); To classify (binary),"Quantify the agreement, or decide whether there is agreement between studies",A formula; A graph,Quantitative and objective,"Clear implementation, easy to implement",Results - numbers and tables,(1) Normality assumption of data,,\cite{bland_statistical_1986},\cite{de_vet_when_2006},"\cite{wang_reproducibility_2022, page_reprise_2021}"
Sceptical Bayes Factor,Reverse-Bayes,"The sceptical Bayes factor combines reverse-Bayes analysis with Bayesian hypothesis testing. First, a sceptical prior is determined for the effect size such that the original finding is no longer convincing in terms of Bayes factors. Then, this prior is contrasted to an advocacy prior (the reference posterior of the effect size based on the original study). Replication success is flagged if the replication data favor the advocacy over the sceptical prior at a higher level than the original data favored the sceptical prior over the null hypothesis. The highest level for which replication success would be declared is then the sceptical Bayes factor. ",(1) Combines several notions of reproducibility: both studies are ensured to have sufficient evidence against the null and it penalises effect estimate incompatibility,"""In light of the replication data, at which level of evidence can an advocate of the original study convince a sceptic?""",Yes,Replicability; Replication,Different data - same analysis,,One original study and one replication study,To quantify (continuous); To classify (binary),Quantification using the sceptical Bayes factor directly. Classification possible using a threshold,A formula,Quantitative and objective,Ready-to-use open-source tool: R package BayesRep available on Github,Results - numbers and tables,(1) Normality of effect estimates,"(1) may suffer from the replication-paradox, where a method flags replication success even thought the sign of the original and replication study go in the opposite direction (2) Normality assumption might be violated with small samples",\cite{pawel_sceptical_2022},,
